Page URL,Page Type,Meta Title,Meta Description,Primary Keyword,Secondary Keywords,Word Count,Schema Type,Content Brief
https://www.mazenoadventures.com/,Homepage,Mazano Adventures - Premier Mountain Expeditions Pakistan,Professional mountaineering expeditions to K2, Broad Peak, Nanga Parbat and more. Expert-guided 8000m+ peak adventures in Pakistan's Karakoram range.,mountain expeditions pakistan,"mountain expeditions pakistan, k2 expedition, nanga parbat trek, pakistan tours, adventure tours pakistan, trekking pakistan, himalaya tours, karakoram expeditions",300,TouristTrip,"Overview of services, featured expeditions, why choose us, testimonials"
https://www.mazenoadventures.com/expeditions,Expeditions Category,K2 Expeditions | 8000m Peaks | Mazano Adventures,Join Mazano Adventures for professionally guided expeditions to K2, Broad Peak, Nanga Parbat and other 8000m peaks in Pakistan's Karakoram range.,k2 expedition pakistan,"k2 expedition pakistan, broad peak climbing, nanga parbat expedition, 8000m peaks pakistan, guided mountain expeditions, karakoram climbing",400,TouristTrip,"List of available expeditions, difficulty levels, booking process, safety measures"
https://www.mazenoadventures.com/trekkings,Trekkings Category,Mountain Treks Pakistan | Mazano Adventures,Discover the best mountain treks in Pakistan with Mazano Adventures. Expert guides, quality equipment, and unforgettable experiences in the Karakoram and Himalayas.,trekking in pakistan,"trekking in pakistan, k2 base camp trek, fairy meadows trek, pakistan mountain trekking, guided treks pakistan, adventure trekking",400,TouristTrip,"List of available treks, difficulty levels, best time to visit, what to expect"
https://www.mazenoadventures.com/destinations,Destinations Category,Mountain Destinations Pakistan | Mazano Adventures,Explore the most spectacular mountain destinations in Pakistan. From K2 to Hunza Valley, discover the beauty of the Karakoram and Himalayas.,mountain destinations pakistan,"mountain destinations pakistan, k2 region, hunza valley, fairy meadows, skardu, nanga parbat area, pakistan travel destinations",400,Place,"Overview of key destinations, how to get there, best time to visit, attractions"
https://www.mazenoadventures.com/expedition/k2-expedition,K2 Expedition Detail,K2 Expedition (8611m) | Mazano Adventures,Professional K2 expedition to the world's second highest peak. 47-day guided climb with expert Sherpas. Book your ultimate mountaineering adventure!,k2 expedition pakistan,"k2 expedition pakistan, k2 climbing package, guided k2 expedition, k2 mountaineering tour, pakistan k2 climbing, 47 day k2 expedition, best k2 climbing company, professional k2 guides, safe k2 expedition, k2 base camp trek, k2 summit attempt, pakistan mountain expedition",600,TouristTrip,"Detailed expedition overview, itinerary, difficulty level, preparation guide, what's included, booking info"
https://www.mazenoadventures.com/expedition/broad-peak-expedition,Broad Peak Expedition Detail,Broad Peak Expedition (8047m) | Mazano Adventures,Join our professionally guided Broad Peak expedition in Pakistan. 45-day climb to the 12th highest mountain with expert support.,broad peak expedition pakistan,"broad peak expedition pakistan, broad peak climbing package, guided broad peak expedition, broad peak mountaineering tour, pakistan broad peak climbing, 45 day broad peak expedition, best broad peak climbing company, professional broad peak guides, safe broad peak expedition, broad peak summit attempt",600,TouristTrip,"Detailed expedition overview, itinerary, difficulty level, preparation guide, what's included, booking info"
https://www.mazenoadventures.com/trek/k2-base-camp-trek,K2 Base Camp Trek Detail,K2 Base Camp Trek | 22 Days | Mazano Adventures,Experience the ultimate K2 Base Camp trek in Pakistan. 22-day guided adventure through the spectacular Baltoro Glacier to the foot of the world's second highest peak.,k2 base camp trek pakistan,"k2 base camp trek pakistan, k2 base camp hiking tour, guided k2 base camp trek, k2 base camp mountain trek, pakistan k2 base camp hiking, 22 day k2 base camp trek, best k2 base camp trek company, professional trek guides pakistan, safe k2 base camp trekking, k2 base camp scenic trek",600,TouristTrip,"Detailed trek overview, daily itinerary, difficulty level, best time to visit, what's included, essential gear, booking process"
https://www.mazenoadventures.com/destination/hunza-valley,Hunza Valley Destination Detail,Hunza Valley | Gilgit-Baltistan | Mazano Adventures,Discover Hunza Valley in Gilgit-Baltistan, Pakistan. Explore ancient forts, apricot orchards, and breathtaking mountain views in this legendary region.,hunza valley pakistan,"hunza valley pakistan, hunza valley travel guide, visit hunza valley pakistan, hunza valley tourist attractions, things to do in hunza valley, hunza valley mountain region, best time to visit hunza valley, hunza valley cultural experience, pakistan hunza valley tour, gilgit baltistan hunza valley travel, hunza valley photography locations, hidden gems hunza valley",500,Place,"Destination overview, key attractions, best time to visit, how to get there, where to stay, local culture, photography tips"